,,,,,,,,,,,,,,,,,,,,,,,,,,,,,,,,,,,,,,,,,,,,,,
Number of Service-wide Forms,,,,,,,,,,,,,,,,,,,,,,,,,,,,,,,,,,,,,,,,,,,,,,
"By Quarter, Form Status, and Processing Time ",,,,,,,,,,,,,,,,,,,,,,,,,,,,,,,,,,,,,,,,,,,,,,
"July 1, 2022 - September 30, 2022",,,,,,,,,,,,,,,,,,,,,,,,,,,,,,,,,,,,,,,,,,,,,,
,,,,,,,,,,,,,,,,,,,,,,,,,,,,,,,,,,,,,,,,,,,,,,
,,,,4th Quarter,,,,,                Fiscal Year - To Date,,,,,,,,,,,,,,,,,,,,,,,,,,,,,,,,,,,,,
,,Forms ,,Completed,,,Processing ,Forms Received,,Completed,,,,,,,,,,,,,,,,,,,,,,,,,,,,,,,,,,,,
Category and Form Number,Description,Received 1,Approved 2,Denied 3,Total 4,Pending 5,Time 6,,Approved,Denied,Total,Pending,,,,,,,,,,,,,,,,,,,,,,,,,,,,,,,,,,
,,,,,,,,,,,,,,,,,,,,,,,,,,,,,,,,,,,,,,,,,,,,,,
TOTAL,," 2,200,024 "," 1,939,071 "," 345,272 "," 2,311,183 "," 8,686,971 ", N/A ," 8,629,636 "," 6,883,950 "," 1,174,863 "," 8,143,283 "," 8,686,971 ",,,,,,,,,,,,,,,,,,,,,,,,,,,,,,,,,,
,,,,,,,,,,,,,,,,,,,,,,,,,,,,,,,,,,,,,,,,,,,,,,
Family Based,,,,,,,,,,,,,,,,,,,,,,,,,,,,,,,,,,,,,,,,,,,,,,
I-129F,Petition for Alien Fiancé(e)," 12,124 "," 5,061 "," 1,972 "," 7,033 "," 55,425 ", 14.0 ," 48,118 "," 16,201 "," 9,492 "," 25,693 "," 55,425 ",,,,,,,,,,,,,,,,,,,,,,,,,,,,,,,,,,
I-130,Petition for Alien Relative," 231,099 "," 110,459 "," 28,828 "," 139,287 "," 1,808,240 ", 14.0 ," 873,073 "," 566,948 "," 133,251 "," 700,199 "," 1,808,240 ",,,,,,,,,,,,,,,,,,,,,,,,,,,,,,,,,,
I-600 7,Petition to Classify Orphan as an Immediate Relative, 194 , 176 , 86 , 262 , 469 , N/A ," 1,086 ", 956 , 278 ," 1,234 ", 469 ,,,,,,,,,,,,,,,,,,,,,,,,,,,,,,,,,,
I-601A,Application for Provisional Unlawful Presence Waiver," 9,349 "," 1,011 ", 279 ," 1,290 "," 121,793 ", 37.9 ," 36,309 "," 5,052 "," 1,012 "," 6,064 "," 121,793 ",,,,,,,,,,,,,,,,,,,,,,,,,,,,,,,,,,
I-751,Petition to Remove Conditions on Residence ," 40,081 "," 22,453 "," 1,558 "," 24,011 "," 270,925 ", 19.3 ," 122,803 "," 103,814 "," 6,111 "," 109,925 "," 270,925 ",,,,,,,,,,,,,,,,,,,,,,,,,,,,,,,,,,
I-800 8,Petition to Classify Convention Adoptee as an Immediate Relative, 436 , 464 , 17 , 481 , 426 , N/A ," 2,571 "," 2,623 ", 70 ," 2,693 ", 426 ,,,,,,,,,,,,,,,,,,,,,,,,,,,,,,,,,,
Employment Based,,,,,,,,,,,,,,,,,,,,,,,,,,,,,,,,,,,,,,,,,,,,,,
I-129,Petition for a Nonimmigrant Worker," 170,702 "," 160,655 "," 27,303 "," 187,958 "," 100,296 ", 2.6 ," 636,483 "," 596,821 "," 101,428 "," 698,249 "," 100,296 ",,,,,,,,,,,,,,,,,,,,,,,,,,,,,,,,,,
I-140,Immigrant Petition for Alien Workers," 57,746 "," 83,790 "," 4,325 "," 88,115 "," 55,514 ", 7.1 ," 185,080 "," 222,314 "," 12,961 "," 235,275 "," 55,514 ",,,,,,,,,,,,,,,,,,,,,,,,,,,,,,,,,,
I-526 22,Immigrant Petition by Alien Investor , 188 , 259 , 276 , 535 ," 13,062 ", 45.3 , 829 , 590 , 825 ," 1,415 "," 13,062 ",,,,,,,,,,,,,,,,,,,,,,,,,,,,,,,,,,
I-765,Application for Employment Authorization (Asylum)," 155,775 "," 145,972 "," 23,444 "," 169,416 "," 440,771 ", 4.3 ," 598,848 "," 439,227 "," 60,306 "," 499,533 "," 440,771 ",,,,,,,,,,,,,,,,,,,,,,,,,,,,,,,,,,
I-765,Application for Employment Authorization (Adjustment Of Status)," 146,858 "," 171,115 "," 29,270 "," 200,385 "," 310,445 ", 5.2 ," 620,209 "," 585,160 "," 153,062 "," 738,222 "," 310,445 ",,,,,,,,,,,,,,,,,,,,,,,,,,,,,,,,,,
I-765,Application for Employment Authorization (DACA)," 72,032 "," 59,741 ", 757 ," 60,498 "," 119,912 ", 12.3 ," 289,327 "," 299,905 "," 2,784 "," 302,689 "," 119,912 ",,,,,,,,,,,,,,,,,,,,,,,,,,,,,,,,,,
I-765,Application for Employment Authorization (All Other)," 207,240 "," 249,722 "," 18,233 "," 267,955 "," 513,174 ", 3.8 ," 840,178 "," 784,903 "," 50,846 "," 835,749 "," 513,174 ",,,,,,,,,,,,,,,,,,,,,,,,,,,,,,,,,,
I-829,Petition by Investor to Remove Conditions on Permanent Resident Status , 69 , 418 , 41 , 459 ," 11,150 ", 47.8 ," 1,270 "," 1,453 ", 168 ," 1,621 "," 11,150 ",,,,,,,,,,,,,,,,,,,,,,,,,,,,,,,,,,
I-924 9,Application For Regional Center Designation Under the Immigrant Investor Program , -   , -   , -   , -   , 139 , N/A , D , -   , -   , -   , 139 ,,,,,,,,,,,,,,,,,,,,,,,,,,,,,,,,,,
I-924A,Annual Certification of Regional Center, -   , -   , -   , -   ," 1,813 ", N/A , 529 , -   , -   , -   ," 1,813 ",,,,,,,,,,,,,,,,,,,,,,,,,,,,,,,,,,
Humanitarian,,,,,,,,,,,,,,,,,,,,,,,,,,,,,,,,,,,,,,,,,,,,,,
I-589 10,Application for Asylum and for Withholding of Removal ," 60,204 "," 3,052 "," 3,047 "," 10,718 "," 571,628 ", N/A ," 195,279 "," 10,099 "," 17,059 "," 41,160 "," 571,628 ",,,,,,,,,,,,,,,,,,,,,,,,,,,,,,,,,,
Legalization 11,Legalization/SAW, 23 , 0 , 15 , 15 , 401 , N/A , 63 , -   , 58 , 58 , 401 ,,,,,,,,,,,,,,,,,,,,,,,,,,,,,,,,,,
I-730,Refugee/Asylee Relative Petition," 3,857 "," 3,971 "," 1,004 "," 4,975 "," 22,707 ", 30.4 ," 11,613 "," 9,585 "," 1,521 "," 11,106 "," 22,707 ",,,,,,,,,,,,,,,,,,,,,,,,,,,,,,,,,,
I-817,Application for Family Unity Benefits, 90 , 40 , 17 , 57 , 342 , 9.8 , 335 , 40 , 17 , 57 , 342 ,,,,,,,,,,,,,,,,,,,,,,,,,,,,,,,,,,
I-821,Application for Temporary Protected Status," 87,072 "," 89,156 "," 1,086 "," 90,242 "," 247,356 ", 12.3 ," 177,589 "," 215,660 "," 2,280 "," 217,940 "," 247,356 ",,,,,,,,,,,,,,,,,,,,,,,,,,,,,,,,,,
I-821D,Consideration of Deferred Action for Childhood Arrivals ," 74,613 "," 58,957 ", 575 ," 59,532 "," 118,548 ", 0.7 ," 304,411 "," 295,480 "," 2,570 "," 298,050 "," 118,548 ",,,,,,,,,,,,,,,,,,,,,,,,,,,,,,,,,,
I-870 12,Record of Determination/Credible Fear Worksheet ," 20,399 "," 9,153 "," 7,158 "," 17,543 "," 4,421 ", N/A ," 68,335 "," 31,571 "," 18,742 "," 54,097 "," 4,421 ",,,,,,,,,,,,,,,,,,,,,,,,,,,,,,,,,,
I-881 13,App. for Susp. of Deport. or Spec. Rule Cancel. of Removal (Sect. 203 of Public Law 105-100 (NACARA)), 50 , 54 , D , 69 , 476 , N/A , 206 , 167 , 19 , 204 , 476 ,,,,,,,,,,,,,,,,,,,,,,,,,,,,,,,,,,
I-899 14,Record of Determination/Reasonable Fear Worksheet ," 2,138 ", 578 , 843 ," 1,768 ", 304 , N/A ," 6,930 "," 1,873 "," 3,052 "," 6,092 ", 304 ,,,,,,,,,,,,,,,,,,,,,,,,,,,,,,,,,,
I-914 15,Application for T Nonimmigrant Status," 1,409 ", 824 , 133 , 957 ," 5,698 ", 11.7 ," 4,935 "," 3,034 ", 636 ," 3,670 "," 5,698 ",,,,,,,,,,,,,,,,,,,,,,,,,,,,,,,,,,
I-918 16,Petition for U Nonimmigrant Status," 13,028 ", 514 ," 1,463 "," 1,977 "," 314,834 ", 58.0 ," 50,342 "," 17,554 "," 6,034 "," 23,588 "," 314,834 ",,,,,,,,,,,,,,,,,,,,,,,,,,,,,,,,,,
I-929,Petition for Qualifying Family Member of a U-1 Nonimmigrant, 240 , 50 , 10 , 60 ," 1,892 ", 22.9 ," 1,000 ", 479 , 107 , 586 ," 1,892 ",,,,,,,,,,,,,,,,,,,,,,,,,,,,,,,,,,
Lawful Permanent Residence,,,,,,,,,,,,,,,,,,,,,,,,,,,,,,,,,,,,,,,,,,,,,,
I-485,Application to Register Permanent Residence or Adjust Status (Family)," 92,386 "," 30,721 "," 8,931 "," 39,652 "," 441,992 ", 13.5 ," 327,184 "," 230,250 "," 40,201 "," 270,451 "," 441,992 ",,,,,,,,,,,,,,,,,,,,,,,,,,,,,,,,,,
I-485,Application to Register Permanent Residence or Adjust Status (Employment)," 38,177 "," 82,970 "," 5,918 "," 88,888 "," 191,190 ", 12.6 ," 168,464 "," 204,631 "," 12,568 "," 217,199 "," 191,190 ",,,,,,,,,,,,,,,,,,,,,,,,,,,,,,,,,,
I-485,Application to Register Permanent Residence or Adjust Status (Asylum)," 6,227 "," 16,555 ", 762 ," 17,317 "," 53,488 ", 22.7 ," 22,705 "," 54,831 "," 2,198 "," 57,029 "," 53,488 ",,,,,,,,,,,,,,,,,,,,,,,,,,,,,,,,,,
I-485,Application to Register Permanent Residence or Adjust Status (Refugee)," 2,771 "," 3,825 ", 161 ," 3,986 "," 20,611 ", 16.5 ," 10,209 "," 13,273 ", 519 ," 13,792 "," 20,611 ",,,,,,,,,,,,,,,,,,,,,,,,,,,,,,,,,,
I-485,Application to Register Permanent Residence or Adjust Status (Cuban)," 11,768 "," 5,550 ", 895 ," 6,445 "," 20,716 ", 3.5 ," 29,138 "," 16,756 "," 2,972 "," 19,728 "," 20,716 ",,,,,,,,,,,,,,,,,,,,,,,,,,,,,,,,,,
I-485,Application to Register Permanent Residence or Adjust Status (Other)," 8,365 "," 8,797 ", 962 ," 9,759 "," 47,892 ", 4.5 ," 42,102 "," 27,236 "," 3,299 "," 30,535 "," 47,892 ",,,,,,,,,,,,,,,,,,,,,,,,,,,,,,,,,,
Citizenship and Nationality,,,,,,,,,,,,,,,,,,,,,,,,,,,,,,,,,,,,,,,,,,,,,,
N-300,Application to File Declaration of Intention, -   , -   , -   , -   , -   , N/A , -   , -   , -   , -   , -   ,,,,,,,,,,,,,,,,,,,,,,,,,,,,,,,,,,
N-336,Req. for a Hearing on a Decision in Natz. Proceedings (Under Sect. 336 of the INA) ," 1,488 ", 817 , 532 ," 1,349 "," 4,577 ", N/A ," 5,840 "," 3,178 "," 2,080 "," 5,258 "," 4,577 ",,,,,,,,,,,,,,,,,,,,,,,,,,,,,,,,,,
N-400 17,Application for Naturalization (Military)," 2,721 "," 2,663 ", 255 ," 2,918 "," 6,386 ", 9.0 ," 9,817 "," 10,562 ", 866 ," 11,428 "," 6,386 ",,,,,,,,,,,,,,,,,,,,,,,,,,,,,,,,,,
N-400 17,Application for Naturalization," 194,819 "," 292,098 "," 31,695 "," 323,793 "," 543,838 ", 9.0 ," 769,989 "," 953,689 "," 110,766 "," 1,064,455 "," 543,838 ",,,,,,,,,,,,,,,,,,,,,,,,,,,,,,,,,,
N-470,Application to Preserve Residence for Naturalization Purposes , -   , -   , -   , -   , D , N/A , -   , -   , -   , -   , D ,,,,,,,,,,,,,,,,,,,,,,,,,,,,,,,,,,
N-565,Application for Replacement Naturalization/Citizenship Document," 8,118 "," 6,464 ", 650 ," 7,114 "," 32,060 ", 11.5 ," 31,150 "," 21,116 "," 2,330 "," 23,446 "," 32,060 ",,,,,,,,,,,,,,,,,,,,,,,,,,,,,,,,,,
N-600 18,Application for Certificate of Citizenship," 17,701 "," 13,706 "," 1,356 "," 15,062 "," 55,975 ", 6.1 ," 66,360 "," 50,272 "," 4,972 "," 55,244 "," 55,975 ",,,,,,,,,,,,,,,,,,,,,,,,,,,,,,,,,,
N-644,Application for Posthumous Citizenship, -   , -   , -   , -   , -   , N/A , -   , -   , -   , -   , -   ,,,,,,,,,,,,,,,,,,,,,,,,,,,,,,,,,,
N-648,Medical Certification for Disability Exceptions," 20,338 ", N/A , N/A ," 20,157 "," 3,833 ", N/A ," 65,392 ", N/A , N/A ," 64,413 "," 3,833 ",,,,,,,,,,,,,,,,,,,,,,,,,,,,,,,,,,
Other,,,,,,,,,,,,,,,,,,,,,,,,,,,,,,,,,,,,,,,,,,,,,,
I-90,Application to Replace Permanent Resident Card," 155,616 "," 128,651 "," 4,212 "," 132,863 "," 1,032,494 ", 4.3 ," 813,500 "," 391,889 "," 11,887 "," 403,776 "," 1,032,494 ",,,,,,,,,,,,,,,,,,,,,,,,,,,,,,,,,,
I-102,Application for Replacement/Initial Nonimmigrant Arrival-Departure Document," 1,006 "," 1,327 ", 593 ," 1,920 "," 3,729 ", 9.9 ," 4,272 "," 3,017 "," 1,295 "," 4,312 "," 3,729 ",,,,,,,,,,,,,,,,,,,,,,,,,,,,,,,,,,
I-131,Application for Travel Document," 18,288 "," 10,491 "," 1,270 "," 11,761 "," 82,206 ", 12.7 ," 72,857 "," 40,669 "," 4,196 "," 44,865 "," 82,206 ",,,,,,,,,,,,,,,,,,,,,,,,,,,,,,,,,,
I-131,Application for Travel Document (Advance Parole)," 120,382 "," 72,897 "," 93,700 "," 166,597 "," 368,522 ", 8.4 ," 578,015 "," 302,360 "," 226,068 "," 528,428 "," 368,522 ",,,,,,,,,,,,,,,,,,,,,,,,,,,,,,,,,,
I-131,Application for Travel Document (Parole-in-Place)," 5,407 "," 1,746 ", 253 ," 1,999 "," 6,068 ", 4.8 ," 20,721 "," 7,241 "," 1,275 "," 8,516 "," 6,068 ",,,,,,,,,,,,,,,,,,,,,,,,,,,,,,,,,,
I-131 19,Application for Travel Document (Humanitarian Parole) ," 2,985 "," 1,314 "," 4,757 "," 6,550 "," 43,871 ", N/A ," 46,248 "," 3,359 "," 12,124 "," 16,569 "," 43,871 ",,,,,,,,,,,,,,,,,,,,,,,,,,,,,,,,,,
I-193,Application for Waiver of Passport and/or Visa , D , D , D , 11 , 394 , 79.2 , 35 , 51 , 22 , 73 , 394 ,,,,,,,,,,,,,,,,,,,,,,,,,,,,,,,,,,
I-360,"Petition for Amerasian, Widow(er), or Special Immigrant "," 22,085 "," 8,149 "," 2,477 "," 10,626 "," 88,276 ", 8.7 ," 80,107 "," 39,926 "," 7,409 "," 47,335 "," 88,276 ",,,,,,,,,,,,,,,,,,,,,,,,,,,,,,,,,,
I-539,Application To Extend/Change Nonimmigrant Status," 68,934 "," 59,031 "," 28,582 "," 87,613 "," 224,260 ", 5.4 ," 267,518 "," 240,458 "," 120,145 "," 360,603 "," 224,260 ",,,,,,,,,,,,,,,,,,,,,,,,,,,,,,,,,,
I-824,Application for Action on an Approved Application or Petition ," 6,833 "," 3,939 ", 619 ," 4,558 "," 13,300 ", 3.4 ," 16,989 "," 10,794 "," 2,152 "," 12,946 "," 13,300 ",,,,,,,,,,,,,,,,,,,,,,,,,,,,,,,,,,
Waivers 20,Waivers," 20,041 "," 6,630 "," 2,300 "," 8,930 "," 269,549 ", 3.6 ," 77,895 "," 34,810 "," 9,507 "," 44,317 "," 269,549 ",,,,,,,,,,,,,,,,,,,,,,,,,,,,,,,,,,
I-290B,Notice of Appeal or Motion ," 6,544 "," 3,077 "," 2,640 "," 5,717 "," 19,582 ", 9.2 ," 25,377 "," 12,073 "," 11,323 "," 23,396 "," 19,582 ",,,,,,,,,,,,,,,,,,,,,,,,,,,,,,,,,,
Supplemental Processing,,,,,,,,,,,,,,,,,,,,,,,,,,,,,,,,,,,,,,,,,,,,,,
DS-230 (IV) 21,Immigrant Visas," 127,462 ", N/A , N/A ,"133,099"," 60,656 ", N/A ," 449,264 ", N/A , N/A ," 453,352 "," 60,656 ",,,,,,,,,,,,,,,,,,,,,,,,,,,,,,,,,,
EOIR Adjustment 21,EOIR Adjustment," 4,992 ", N/A , N/A ," 4,992 "," 24,258 ", N/A ," 21,363 ", N/A , N/A ," 21,363 "," 24,258 ",,,,,,,,,,,,,,,,,,,,,,,,,,,,,,,,,,
Table Key:,,,,,,,,,,,,,,,,,,,,,,,,,,,,,,,,,,,,,,,,,,,,,,
N/A  Not available,,,,,,,,,,,,,,,,,,,,,,,,,,,,,,,,,,,,,,,,,,,,,,
D  Disclosure standards not met,,,,,,,,,,,,,,,,,,,,,,,,,,,,,,,,,,,,,,,,,,,,,,
- Represents zero or rounds to 0.0,,,,,,,,,,,,,,,,,,,,,,,,,,,,,,,,,,,,,,,,,,,,,,
References:,,,,,,,,,,,,,,,,,,,,,,,,,,,,,,,,,,,,,,,,,,,,,,
1 Forms Received are the number of new applications or petitions received and entered into a case-tracking system during the reporting period.,,,,,,,,,,,,,,,,,,,,,,,,,,,,,,,,,,,,,,,,,,,,,,
2 The number of applications or petitions approved during the reporting period.,,,,,,,,,,,,,,,,,,,,,,,,,,,,,,,,,,,,,,,,,,,,,,
3 The number of applications or petitions that were denied during the reporting period. Outcomes included in this count will vary by benefit type as not all benefit types have all of these outcomes in every reporting period.  ,,,,,,,,,,,,,,,,,,,,,,,,,,,,,,,,,,,,,,,,,,,,,,
"4 Total Completions on the 'Total - All Forms' line are approvals plus denials with three exceptions: N-648 does not break down Approvals and Denials, only Completions; and I-589 and I-131 (Humanitarian Parole) include administratively closed cases in Completions, which are not reported under the Approvals or Denials. ",,,,,,,,,,,,,,,,,,,,,,,,,,,,,,,,,,,,,,,,,,,,,,
5 The number of applications or petitions awaiting a decision as of the end of the reporting period. Some actions taken on cases are not reflected in this report such as administrative closures and transfers between offices; thus the total pending counts cannot be calculated using data from previous reporting periods.,,,,,,,,,,,,,,,,,,,,,,,,,,,,,,,,,,,,,,,,,,,,,,
"6 Processing times are defined as the number of months it took for an application, petition, or request to be processed from receipt to completion in a given time period. The number of months presented is the median which is the time it took to complete 50% of all the cases processed in the quarter.",,,,,,,,,,,,,,,,,,,,,,,,,,,,,,,,,,,,,,,,,,,,,,
"7 Includes I-600A, Application for Advance Processing of an Orphan Petition.",,,,,,,,,,,,,,,,,,,,,,,,,,,,,,,,,,,,,,,,,,,,,,
"8 Includes I-800A, Application for Determination of Suitability to Adopt a Child from a Convention Country.",,,,,,,,,,,,,,,,,,,,,,,,,,,,,,,,,,,,,,,,,,,,,,
"9 I-924 approvals include regional center reaffirmations and I-924 denials include regional center terminations. Statutory authorization related to the EB-5 Immigrant Investor Regional Center Program on June 30, 2021. Therefore, USCIS has suspended calculations of processing times for form I-924.",,,,,,,,,,,,,,,,,,,,,,,,,,,,,,,,,,,,,,,,,,,,,,
"10Data are for affirmatively filed I-589 asylum applications and do not include defensive asylum claims before a DOJ EOIR immigration court. For affirmative I-589s, the “denial” column includes cases where USCIS found the applicant ",,,,,,,,,,,,,,,,,,,,,,,,,,,,,,,,,,,,,,,,,,,,,,
not eligible on the merits of the claim and referred the applicant to an immigration judge. Previous reports did not include referrals in the denied counts. Administratively closed cases are not included in approvals or denials but are included in the total number of completions.,,,,,,,,,,,,,,,,,,,,,,,,,,,,,,,,,,,,,,,,,,,,,,
"11 Includes the following applications for persons applying for benefits under the Immigration Reform and Control Act of 1986:  Forms I-687, I-700. I-698, I-690, I-694, and I-695.",,,,,,,,,,,,,,,,,,,,,,,,,,,,,,,,,,,,,,,,,,,,,,
"12 Credible fear cases approved indicate fear established. Credible fear cases denied indicate fear not established.  Administratively closed cases are not included in approvals or denials, but are included in total number of completions.",,,,,,,,,,,,,,,,,,,,,,,,,,,,,,,,,,,,,,,,,,,,,,
13    NACARA cases approved indicate a grant of suspension of deportation or special rule cancellation of removal and adjustment of status. Denied indicates USCIS found the applicant not eligible on the merits of the claim and referred the applicant to an immigration judge. ,,,,,,,,,,,,,,,,,,,,,,,,,,,,,,,,,,,,,,,,,,,,,,
"Administratively closed and dismissed cases are not included in approvals or denials, but are included in total number of completions.",,,,,,,,,,,,,,,,,,,,,,,,,,,,,,,,,,,,,,,,,,,,,,
"14 Reasonable fear cases approved indicate fear established. Reasonable fear cases denied indicate fear not established. Administratively closed cases are not included in approvals or denials, but are included in total number of completions.",,,,,,,,,,,,,,,,,,,,,,,,,,,,,,,,,,,,,,,,,,,,,,
"15 Includes I-914A, Application for Family Member of T-1 Recipient.",,,,,,,,,,,,,,,,,,,,,,,,,,,,,,,,,,,,,,,,,,,,,,
"16 Includes I-918A, Petition for Qualifying Family Member of U-1 Recipient. Processing times shown are from initial filing to Bona Fide Determination (BFD) Review.",,,,,,,,,,,,,,,,,,,,,,,,,,,,,,,,,,,,,,,,,,,,,,
17 Processing Times shown are for all N-400 Applications for Naturalization.,,,,,,,,,,,,,,,,,,,,,,,,,,,,,,,,,,,,,,,,,,,,,,
"18 Includes N-600K, Application for Citizenship and Issuance of Certificate Under Section 322. ",,,,,,,,,,,,,,,,,,,,,,,,,,,,,,,,,,,,,,,,,,,,,,
19 This report reflects data for requests filed for individuals outside of the United States requesting parole into the United States based on urgent humanitarian or significant public benefit reasons and individuals inside the United States requesting re-parole.,,,,,,,,,,,,,,,,,,,,,,,,,,,,,,,,,,,,,,,,,,,,,,
"20 Includes the following applications filed to waive exclusionary grounds:  Forms I-191, I-192, I-212, I-601, I-602, and I-612.",,,,,,,,,,,,,,,,,,,,,,,,,,,,,,,,,,,,,,,,,,,,,,
"21 Immigrant Visa and EOIR Adjustment are not included in the ""Total - All Forms"" line. ",,,,,,,,,,,,,,,,,,,,,,,,,,,,,,,,,,,,,,,,,,,,,,
"22Includes I-526E, Immigrant Petition by Regional Center Investor",,,,,,,,,,,,,,,,,,,,,,,,,,,,,,,,,,,,,,,,,,,,,,
Notes:,,,,,,,,,,,,,,,,,,,,,,,,,,,,,,,,,,,,,,,,,,,,,,
"1) Some applications or petitions approved, denied, or pending a decision may have been received in previous reporting periods. ",,,,,,,,,,,,,,,,,,,,,,,,,,,,,,,,,,,,,,,,,,,,,,
2) The report reflects the most up-to-date estimate available at the time the database is queried.,,,,,,,,,,,,,,,,,,,,,,,,,,,,,,,,,,,,,,,,,,,,,,
"3) Forms received, completed (approved and denied), and pending counts may differ from counts reported in previously published reports due to processing delays and the time at which the data are queried, system updates, and post-adjudicative outcomes.",,,,,,,,,,,,,,,,,,,,,,,,,,,,,,,,,,,,,,,,,,,,,,
"4) Completed are the number of applications or petitions approved or denied. Some benefit types include other outcomes, such as administrative closures, in the total number of completed cases. As such, approvals and denials will not sum to the total number of completions for all benefit types.",,,,,,,,,,,,,,,,,,,,,,,,,,,,,,,,,,,,,,,,,,,,,,
5) Forms where a processing time is unavailable are shown with an N/A. Processing times may be unavailable for a variety of reasons such as forms pending a processing times calculation or forms where times cannot be calculated. ,,,,,,,,,,,,,,,,,,,,,,,,,,,,,,,,,,,,,,,,,,,,,,
6) Summing the six I-485 types and the four I-765 types results in the overall totals for each form for the reporting period. ,,,,,,,,,,,,,,,,,,,,,,,,,,,,,,,,,,,,,,,,,,,,,,
"7) Credible Fear and Reasonable Fear screenings (and their respective forms I-870 and I-899) do not confer an immigration benefit, rather they are intended to identify individuals with viable protection claims, which are then referred to the Immigration Courts for adjudication. ",,,,,,,,,,,,,,,,,,,,,,,,,,,,,,,,,,,,,,,,,,,,,,
   Asylum Officers do not adjudicate the actual asylum applications during the screening process.,,,,,,,,,,,,,,,,,,,,,,,,,,,,,,,,,,,,,,,,,,,,,,
"8) For the I-131 (humanitarian parole), approvals are defined as conditional approval of the request for parole contingent upon successful completion of identity verification and any additional medical and security checks as required. ",,,,,,,,,,,,,,,,,,,,,,,,,,,,,,,,,,,,,,,,,,,,,,
"    A request for humanitarian parole may be counted as closed for a number of reasons, including if the beneficiary withdraws the request or if USCIS has notified the petitioner that the case is eligible for further parole processing and is awaiting notification from the petitioner that the parole ",,,,,,,,,,,,,,,,,,,,,,,,,,,,,,,,,,,,,,,,,,,,,,
    beneficiary is in a location with a U.S. embassy or consulate.,,,,,,,,,,,,,,,,,,,,,,,,,,,,,,,,,,,,,,,,,,,,,,
9) The majority of the I-730 completions are captured in CLAIMS3 and included in this data. The I-730 processing times are based on completions made at the Texas and Nebraska Service Centers only.,,,,,,,,,,,,,,,,,,,,,,,,,,,,,,,,,,,,,,,,,,,,,,
"10) For a complete list of USCIS forms and descriptions, visit https://www.uscis.gov/forms",,,,,,,,,,,,,,,,,,,,,,,,,,,,,,,,,,,,,,,,,,,,,,
,,,,,,,,,,,,,,,,,,,,,,,,,,,,,,,,,,,,,,,,,,,,,,
Source:,,,,,,,,,,,,,,,,,,,,,,,,,,,,,,,,,,,,,,,,,,,,,,
"All data except I-589, I-870, I-899 and I-881 - Department of Homeland Security, U.S. Citizenship and Immigration Services, Office of Performance and Quality",,,,,,,,,,,,,,,,,,,,,,,,,,,,,,,,,,,,,,,,,,,,,,
"I-589, I-870, I-899, I-881, I-131 (Humanitarian Parole) data were provided by the Refugee, Asylum and International Operations (RAIO) Directorate",,,,,,,,,,,,,,,,,,,,,,,,,,,,,,,,,,,,,,,,,,,,,,
"PRT, ELIS, CLAIMS3, queried 10/2022, TRK 10761",,,,,,,,,,,,,,,,,,,,,,,,,,,,,,,,,,,,,,,,,,,,,,
